title,image_url,category,era,size_and_description
「臨池真賞」墨,https://digitalarchive.npm.gov.twhttps://digitalarchive.npm.gov.tw/opendata/Image/GetImage?imageId=334919&randomCode=15078280,文具,清 康熙五十五年,高23.0公分 徑長4.6公分 寬4.2公分 八方柱狀墨，質堅緻。一面有陰文填金篆字︰「臨池真賞」，另面有陰文填藍隸書︰「 寶恩堂藏墨」，下鈐填金方印二︰「清玩」、「人生一樂」；兩側有陽文小字楷款︰「康熙丙申年製」、「汪希古造」。汪希古為清初歙人。《(乾隆)歙縣志》述製墨名家謂︰「而近則曹素功……同時居肆如吳守默、汪希古、葉公侶類，皆譽擅黑松。……」本墨作於康熙五十五年(1716 )，邱學敏《百十二家墨緣》中另有「康熙五十三年歙縣草莽臣汪希古」款的墨，則汪希古活躍於康熙後期，其墨曾上貢供卿。
「大壑五山」圓墨,https://digitalarchive.npm.gov.twhttps://digitalarchive.npm.gov.tw/opendata/Image/GetImage?imageId=334929&randomCode=52638231914,文具,明,高2.0公分 徑16.3公分 圓形墨，邊框起棱，一面模印明代文人焦竑所書〈大壑五山〉銘文，並見模鈐「弱候」印記與款識。另面則模印水面上有五座大山，方別位於四角與中央，正合焦竑所書寫的〈大壑五山〉銘記。此墨圖式見之於明代程君房《程氏墨苑》中，但本墨墨側只有「癸卯」款而無人名款，又其「卯」字有損傷。
「六龍御天頌」圓墨,https://digitalarchive.npm.gov.twhttps://digitalarchive.npm.gov.tw/opendata/Image/GetImage?imageId=334936&randomCode=90402346619,文具,明,徑16.0公分 圓形墨，邊框起棱，一面模印程君房所作之〈六龍御天頌〉。另面則模印六龍穿梭於雲間，一龍居中，身形最為碩大，正面向墨面外直視，眼神威嚴。其他五小龍則環繞於大龍周邊。墨側「君房聘袞監製」，聘袞或為與程君房相關之人，但文獻未見有記載。程君房為明代重要的製墨家，所以本墨以白綾布包、紅漆盒、包袱等層層包覆裝置，可見寶愛此墨的用心用意。
御題《萬春集慶》冊〈萬壑春雲〉詩綠墨,https://digitalarchive.npm.gov.twhttps://digitalarchive.npm.gov.tw/opendata/Image/GetImage?imageId=336883&randomCode=58894373431,文具,清 嘉慶十四年,長11.36公分 寬5.37公分 高1.82公分 長方形綠色顏料墨，細膩鮮豔。雙面起邊框，皆飾回紋一圈，一面作填金楷書御題詩「御題萬壑春雲冊詩。從龍翔鳳結絪緼，洞壑英英吐白雲，出岫無心羣待族，筆端造化幻繽紛。」另一面模印奇石幻山間，勁松挺立朵雲繚繞。墨兩側各有陽文楷款「嘉慶己巳（1809）年製」、「臣董教增恭錄」。五色畫錠一套十件，共收於雙龍「御題萬春集慶冊五色畫錠」漆盒。
御題《萬春集慶》冊〈萬派春濤〉詩藍墨,https://digitalarchive.npm.gov.twhttps://digitalarchive.npm.gov.tw/opendata/Image/GetImage?imageId=336893&randomCode=46312852928,文具,清 嘉慶十四年,長11.57公分 寬5.49公分 高1.79公分 長方形藍色顏料墨，細膩鮮豔。雙面起邊框，皆飾回紋一圈，一面作填金楷書御題詩「御題萬派春濤冊詩。新水淪漣滿四澤，桃花初漲漾輕濤，挂帆擬欲遊天上，境象清幽散彩毫。」另一面模印大海波濤，中有孤帆徜徉其上。五色畫錠一套十件，共收於雙龍「御題萬春集慶冊五色畫錠」漆盒。
澄泥玉堂硯,https://digitalarchive.npm.gov.twhttps://digitalarchive.npm.gov.tw/opendata/Image/GetImage?imageId=176433&randomCode=71806836407,文具,清,長21.3公分 寬13.0公分 高4.1公分 硯呈長方形，受墨處微窪下，硯面平廣斜下為墨池，墨池深廣，硯色黃，質輕極為細膩，硯面滿佈墨鏽，硯背覆手從上漸往下削，而成兩跗，耐高2.9公分，《硯譜》云為玉堂舊式也，中央鐫清高宗御題詩乙首：「陶自唐年抑宋年，玉堂舊式看依然，欲詢執筆其北者，上水船乎下水船。」鈐印二：「乾隆宸翰」、「惟精惟一」，款題：「乾隆戊戌御題」。按「乾隆戊戌」為清高宗乾隆四十三年，西元1778年，此御題詩亦著錄於《清高宗御製詩文全集》八，《御製詩》四集，卷七十五，頁十六。
仿澄泥虎伏硯,https://digitalarchive.npm.gov.twhttps://digitalarchive.npm.gov.tw/opendata/Image/GetImage?imageId=176437&randomCode=53186538298,文具,清 乾隆,長14.2公分 寬9.0公分 高4.8公分 全器作臥虎之形，色褐紫，器表滿佈仿古銅器的青綠鏽色。硯面沿邊起細棱，蓋邊突起寬邊以與硯身扣合。墨池呈太極圖形，墨堂略凹。硯蓋虎首兩小耳微尖，雙眼高突，略具貓態。蓋內陰刻清高宗隸書硯銘：「呂老所造，茲不可得；金閶巧鍛，如伏虎式，球琳其質，青綠其色；置之舊側，幾難別白；列於文房，友乎子墨；幾暇怡情，揮毫是北；每繹旅獒，不無慚德。」款：「乾隆戊戌仲夏，御銘」，印：「比德」、「朗潤」。這方硯收錄於《西清硯譜》卷二十三，頁三十四-三十七，成書之時這方硯收貯在文源閣。就目前的考古出土資料所知，這類硯式乃倣自漢硯中的異獸銅硯盒之外形，考古出土的漢硯實物中有一類可以歸為板研之列，但石硯收貯在銅製異獸形硯盒中，就目前所知已有兩例，一件是1957年出土於安徽省肥東縣，異獸作伏臥狀，頭生雙角，腰間雙翼，全身鑲嵌紅、藍色料珠，兩眼嵌淡綠色料質裝飾，通高6.5、器身高3.0、長12.5公分；另一件是1970年出土於江蘇徐州土山漢墓，銅異獸形制與前者相似，但器較大（長25.0、寬14.8、高0.5公分），通體鎏金，並鑲嵌珊瑚、綠松石、青金石等次寶石。虎伏硯式或即是受漢代這類硯盒影響下的附會之作。清高宗閱讀過南唐宋初張洎所撰《賈氏談錄》有關山西絳縣人收取澄泥的方法，於乾隆四十年（1775）首次使用宮中舊藏澄泥硯後，大為佳賞，遂於當年夏天諭令當時山西巡撫巴延三留心尋訪，第二年就在汾水取得澄泥硯材。雖然在絳縣取得硯材，但是當時絳縣並無燒造澄泥硯的匠人，遂發交蘇州研製，由這方澄泥虎伏硯可知至少在乾隆四十三年（1778）「吳中巧匠」已能「仿造進御」。
端石海天浴日硯,https://digitalarchive.npm.gov.twhttps://digitalarchive.npm.gov.tw/opendata/Image/GetImage?imageId=176441&randomCode=1752227528,文具,明,長19.3公分 寬13.4公分 高4.9公分 此硯為端溪子石。全器硯面及背滿刻海水波浪洶湧澎湃之中，擁襯一輪朝日，是作硯堂，硯首海浪低漩即作墨池。硯背在海浪洶湧中，浮硯一旭日，中淺浮雕一三足鳥。硯右側壁平坦處，鐫清高宗御題銘乙首，隸書、「洪波浡潏天之綱，咸池沐浴陽德光，紫雲既劚金烏翔，葆珍韞彩登文房，挹茲學海吐沛滂。」款題：「乾隆乙未春御題」（四十年，1775），鈐印二：「古香」、「太璞」。
暖硯,https://digitalarchive.npm.gov.twhttps://digitalarchive.npm.gov.tw/opendata/Image/GetImage?imageId=176452&randomCode=1907506027,文具,清 乾隆,長14.2公分 寬10.8公分 高1.2公分 玉石質，色淡紫。硯作長方形，硯面琢成瓶形，瓶口至肩部為墨池，其周圍雕飾幾何化動物紋，墨池中央挖空一桃形，硯面中央有一紅色圓形。硯背漥下，中央行書：「體具剛柔。用合動靜。日萬幾。欽屢省。福天下兮緜世永。」款題「乾隆御製」，下接鈐印「乾隆御賞」。
澄泥鳳鏡硯,https://digitalarchive.npm.gov.twhttps://digitalarchive.npm.gov.tw/opendata/Image/GetImage?imageId=176465&randomCode=22994970526,文具,宋,高2.5公分 徑15.2公分 澄泥硯，色紫，泛赭斑，硯面有使用後殘留痕跡。硯作圓形，硯面上端雕一鳳，鳳尾長而環繞硯緣，下漥以為墨池。硯背凹下，刻八字篆款。硯壁刻詩文：「唐時佳話。宋時製鏡。古依然見巳宜。合贈舍人賈至矣。鳳毛池上用為儀。」款題「乾隆丙午仲夏御題」（五十一年，1785），下接兩鈐印「古稀天子」、「猶日孜孜」。
澄泥龍珠硯,https://digitalarchive.npm.gov.twhttps://digitalarchive.npm.gov.tw/opendata/Image/GetImage?imageId=173048&randomCode=514469624,文具,元,長15.4公分 寬9.6公分 高2.1公分 硯體琢成幡龍形，澄泥製，色黃泛紫色，硯面受墨處作正圓形，有如蟠龍抱珠之勢，墨池正處在龍口，有呼風吐雨之狀，硯背右側刻御題銘一首：「墨華吐沛時雨」，鈐印：「乾」、「隆」連珠印，硯背作為龍腹，亦刻銘一首，計十六字，唯內缺一字，「乾魁至文，陰陽既分，爰此龍□、曰美斯聞。」款署：「魯宣」二字，皆篆書，鈐印一：「仲圭」。按「仲圭」，係元吳鎮字，善書畫，此硯蓋其所寶者。
澄泥蟠螭硯,https://digitalarchive.npm.gov.twhttps://digitalarchive.npm.gov.tw/opendata/Image/GetImage?imageId=173056&randomCode=814138053,文具,宋,長17.1公分 寬10.6公分 高2.8公分 硯作長方形，澄泥製，其色黃而淡，質輕，極為細緻，《西清硯譜》云為：「澄泥中最上品者」。墨池中浮雕一伏臥螭紋，然已有漫漶不清之感，硯面受墨處深窪，硯背上深下淺，此硯正背兩面，應均可受墨，通體滿佈墨鏽，應是宋代之物無疑，硯壁周側環刻清高宗御題銘乙首，此銘亦收入《清高宗御製詩文全集》一，《御製文》二集，卷四十，頁五－六。銘曰：「囊汾水之土乎，規南皮之瓦手，是何質堅而色古乎，扣之鏗然如戛金石，其徐韻悠揚又如琴瑟之搏拊乎，蟠以文螭，有若蛟龍之興雲雨乎，硯乎、硯乎，供奉懋勤，渙汗其大，號渙玉居，庶幾无咎乎。」款題「乾隆戊戌御銘」，鈐印一：「幾暇臨池」，按「戊戌」為「乾隆四十三年」，西元1778年。
御詠花卉詩「翠雀」藍墨,https://digitalarchive.npm.gov.twhttps://digitalarchive.npm.gov.tw/opendata/Image/GetImage?imageId=182158&randomCode=29236710275,文具,清 乾隆,長11.4公分 長方形藍色墨，邊框起棱。一面有填金隸書乾隆詩作：「御詠翠雀。居然眼翅如生動，曉露承來吐細芬，便有遊蜂欲採蕊，何妨物類本同羣。」一面模印翠雀花為飾。是墨與其他二十四塊同儲一盒，為成套之御製花卉詩套墨。
御詠花卉詩「蘭」綠墨,https://digitalarchive.npm.gov.twhttps://digitalarchive.npm.gov.tw/opendata/Image/GetImage?imageId=182161&randomCode=72044255264,文具,清 乾隆,長11.3公分 長方形綠色墨，邊框起棱。一面有填金隸書乾隆詩作：「御詠蘭。成圖可識神來筆，紉佩定知香滿衣，青瑣玉堂恐未稱，雅宜九畹傍紫扉。」一面模印蘭花一株，蘭葉弧垂交疊，蘭花挺直盛開。是墨與其他二十四塊同儲一盒，為成套之御製花卉詩套墨。
御詠花卉詩「珍珠蘭」綠墨,https://digitalarchive.npm.gov.twhttps://digitalarchive.npm.gov.tw/opendata/Image/GetImage?imageId=182164&randomCode=38865012727,文具,清 乾隆,長11.4公分 長方形綠色墨，邊框起棱。一面有填金隸書乾隆詩作：「御詠珍珠蘭。垂垂黃穗擬珠珍，薰茗烹湯香滿脣，花譜卻稱色正紫，從知記載信誰真。」一面模印珍珠蘭三枝由左下伸出，花葉繁茂，作盛開之狀。是墨與其他二十四塊同儲一盒，為成套之御製花卉詩套墨。
御詠花卉詩「石竹」綠墨,https://digitalarchive.npm.gov.twhttps://digitalarchive.npm.gov.tw/opendata/Image/GetImage?imageId=182167&randomCode=32575093052,文具,清 乾隆,長11.3公分 長方形綠色墨，邊框起棱。一面有填金隸書乾隆詩作：「御詠石竹。石側㛹娟致冶幽，有枝有葉卻非脩，不於霜後看稜節，五色應迷王子猷。」一面模印石竹兩枝由右下伸出，花葉繁茂，作盛開之狀。是墨與其他二十四塊同儲一盒，為成套之御製花卉詩套墨。
御詠花卉詩「鳳仙」綠墨,https://digitalarchive.npm.gov.twhttps://digitalarchive.npm.gov.tw/opendata/Image/GetImage?imageId=182170&randomCode=85146210379,文具,清 乾隆,長11.4公分 長方形綠色墨，邊框起棱。一面有填金隸書乾隆詩作：「御詠鳳仙。揚毳最合臨秋曉，弄景偏宜對月明，一種閒庭風露下，騎來定是董雙成。」一面模印鳳仙花兩枝，花葉繁茂。為盛開生長之狀。是墨與其他二十四塊同儲一盒，為成套之御製花卉詩套墨。
御詠花卉詩「梅」綠墨,https://digitalarchive.npm.gov.twhttps://digitalarchive.npm.gov.tw/opendata/Image/GetImage?imageId=182173&randomCode=21080810315,文具,清 乾隆,長11.4公分 長方形綠色墨，邊框起棱。一面有填金隸書乾隆詩作：「御詠梅。古淡丰姿清淨香，貞元消息朵中藏，女夷若道無神解，那令斯華殿眾芳。」一面模印梅花一枝，枝幹彎折，作盛開之狀。是墨與其他二十四塊同儲一盒，為成套之御製花卉詩套墨。
御詠花卉詩「瑞香」白墨,https://digitalarchive.npm.gov.twhttps://digitalarchive.npm.gov.tw/opendata/Image/GetImage?imageId=182176&randomCode=922905205,文具,清 乾隆,長11.3公分 長方形白色墨，邊框起棱。一面有填金隸書乾隆詩作：「御詠瑞香。麝作輕囊雲作窩，柔枝不勝體婆娑，比邱設謂間香得，應是無端墮睡魔。」一面模印。墨側有瑞香花兩枝，枝葉茂盛，花作盛開之狀。是墨與其他二十四塊同儲一盒，為成套之御製花卉詩套墨。
御詠花卉詩「水仙」白墨,https://digitalarchive.npm.gov.twhttps://digitalarchive.npm.gov.tw/opendata/Image/GetImage?imageId=182178&randomCode=689290217,文具,清 乾隆,長11.0公分 長方形白色墨，邊框起棱。一面有填金隸書乾隆詩作：「御詠水仙。心鏤黃金瓣裁玉，玉金豈足累清高，傳神若問誰稱最，八斗唯應子建曹。」一面模印水仙兩株，花作盛開之貌。是墨與其他二十四塊同儲一盒，為成套之御製花卉詩套墨。
御詠花卉詩「梨花」白墨,https://digitalarchive.npm.gov.twhttps://digitalarchive.npm.gov.tw/opendata/Image/GetImage?imageId=182181&randomCode=2043074319,文具,清 乾隆,長10.9公分 長方形白色墨，邊框起棱。一面有填金隸書乾隆詩作：「御詠梨花。喜白為姿懶著紅，傳根疑是水晶宮，十分靚豔曾何礙，饒有一般林下風。」一面模印梨花兩枝由左下伸出，花葉繁茂，作盛開之狀。是墨與其他二十四塊同儲一盒，為成套之御製花卉詩套墨。
御詠花卉詩「玉蘭」白墨,https://digitalarchive.npm.gov.twhttps://digitalarchive.npm.gov.tw/opendata/Image/GetImage?imageId=182184&randomCode=53687730970,文具,清 乾隆,長10.9公分 長方形白色墨，邊框起棱。一面有填金隸書乾隆詩作：「御詠玉蘭。迎春樹樹綻芳蕤，蘭想清香玉想姿，卻以詩人稱木筆，侵尋奪席笑辛夷。」一面模印玉蘭花由右下斜出，滿枝皆花，盛開含苞者皆見。是墨與其他二十四塊同儲一盒，為成套之御製花卉詩套墨。
御詠花卉詩「繡毬花」白墨,https://digitalarchive.npm.gov.twhttps://digitalarchive.npm.gov.tw/opendata/Image/GetImage?imageId=182187&randomCode=680300466,文具,清 乾隆,長10.9公分 長方形白色墨，邊框起棱。一面有填金隸書乾隆詩作：「御詠繡毬花。幾度江南見花朵，祇疑枝上雪攢球，玲瓏簇就煙霞體，點綴真宜山水州。」一面模印繡毬花兩枝由左側伸出，花葉繁茂，作盛開之狀。是墨與其他二十四塊同儲一盒，為成套之御製花卉詩套墨。
御詠花卉詩「紫薇」硃墨,https://digitalarchive.npm.gov.twhttps://digitalarchive.npm.gov.tw/opendata/Image/GetImage?imageId=182190&randomCode=27151167008,文具,清,長11.4公分 長方形硃墨，邊框起棱。一面有填金隸書乾隆詩作：「御詠紫薇。常開夏裏輕盈色，亦散風前淡蕩香，卻笑無心花木種，那知世有令和郎。」是墨與其他二十四塊同儲一盒，為成套之御製花卉詩套墨。
御詠花卉詩「荷」硃墨,https://digitalarchive.npm.gov.twhttps://digitalarchive.npm.gov.tw/opendata/Image/GetImage?imageId=182197&randomCode=35838556095,文具,清,長11.3公分 長方形硃墨，邊框起棱。一面有填金隸書乾隆詩作：「御詠荷。鯉魚風動柄柶搖，破葉?華勢若飄，卻是色香真淨處，水天了了照清寥。」一面模印荷花荷葉為飾，其中荷花三朵，兩朵盛開，一朵含苞，荷葉張展翻折，各具姿態。是墨與其他二十四塊同儲一盒，為成套之御製花卉詩套墨。
御詠花卉「錦葵」詩硃墨,https://digitalarchive.npm.gov.twhttps://digitalarchive.npm.gov.tw/opendata/Image/GetImage?imageId=182200&randomCode=42308640234,文具,清 乾隆,長11.2公分 長方形硃墨，邊框起棱。一面有填金隸書乾隆詩作：「御詠錦葵。淡紫深紅麗蕊繁，開時頗足張秋園，如荍應憶詩人奏，况我所司風化原。」一面模印錦葵一株，枝葉茂盛，花作盛開之狀。是墨與其他二十四塊同儲一盒，為成套之御製花卉詩套墨。
玉人,https://digitalarchive.npm.gov.twhttps://digitalarchive.npm.gov.tw/opendata/Image/GetImage?imageId=150048&randomCode=64494055710,玉器,清,長6.6公分 高7.9公分 白玉，玉色泛青。全器略成扁形，雕作兩人物，身穿長袍老者與持桃童子，一旁有鹿趴伏於地。
玉海棠式盆托,https://digitalarchive.npm.gov.twhttps://digitalarchive.npm.gov.tw/opendata/Image/GetImage?imageId=150051&randomCode=50664504175,玉器,清,長13.1公分 寬10.5公分 通高2.0公分 白玉，玉色泛黃，局部有赭斑。盤作海棠花瓣形，弧形壁，下有四足。盤內有一圓托，用以承杯碗。
圭璧形飾,https://digitalarchive.npm.gov.twhttps://digitalarchive.npm.gov.tw/opendata/Image/GetImage?imageId=150056&randomCode=33296644061,玉器,清,長6.7公分 寬5.1公分 白玉，玉色白。全器略呈扁圓形，中央部份作「圭璧」之形，其上陰刻卷雲紋，前後各有一鳳紋盤繞。
玉佩,https://digitalarchive.npm.gov.twhttps://digitalarchive.npm.gov.tw/opendata/Image/GetImage?imageId=150059&randomCode=34951556232,玉器,清,長10.8公分 寬6.9公分 厚0.7公分 白玉，玉色泛黃。全器呈片狀橢圓形。正反面紋飾皆同：雕作手持如意童子，以單腳立於葫蘆之上，橫倒於下方的葫蘆，由口中長出綿延的靈芝。童子旁並有一蝙蝠。有多子多如意福氣之吉祥意義。
翠玉十角圈,https://digitalarchive.npm.gov.twhttps://digitalarchive.npm.gov.tw/opendata/Image/GetImage?imageId=150062&randomCode=54967190042,玉器,清,長8.8公分 厚1.3公分 孔徑4.3公分 翠玉，玉色白綠相雜。全器呈圈形，外石角形，內圓形的環狀物。應為待雕琢的玉料。
翠玉長方形器,https://digitalarchive.npm.gov.twhttps://digitalarchive.npm.gov.tw/opendata/Image/GetImage?imageId=150066&randomCode=87899703448,玉器,清,長7.9公分 寬5.5公分 厚1.1公分 翠玉，玉色白綠相雜。全器呈長方形，應為待雕琢之玉料。
玉插屏,https://digitalarchive.npm.gov.twhttps://digitalarchive.npm.gov.tw/opendata/Image/GetImage?imageId=150070&randomCode=84690642232,玉器,清,長10.48公分 寬7.4公分 厚0.88公分 白玉，玉色白潤。全器作片狀長方形。以陰刻填金作松鶴圖。另一面有溫承惠隸書御製詩：「御製松鶴清越。仙鶴雙雙舞。蟠龍鬱鬱高。臨風翻雷羽。映曰捲天濤。密蔭留三島。清音上九皋。億齡同獻壽。共慶盛時遭。臣溫承惠敬書。」
玉石榴,https://digitalarchive.npm.gov.twhttps://digitalarchive.npm.gov.tw/opendata/Image/GetImage?imageId=150075&randomCode=68657880217,玉器,清,寬7.9公分 通高6.6公分 厚4.7公分 白玉，局部有赭斑。全器作大小相連帶枝葉石榴果實，玉料略呈三角形。果實底部並有陰刻蝙蝠。石榴與蝙蝠有象徵多子福氣的吉祥意義。
玉葫蘆,https://digitalarchive.npm.gov.twhttps://digitalarchive.npm.gov.tw/opendata/Image/GetImage?imageId=150081&randomCode=37839039513,玉器,清,寬6.9公分 通高10.0公分 厚3.1公分 白玉，玉色泛黃。全器為一帶瓜蒂藤蔓的葫蘆，並帶連枝小葫蘆。葫蘆一側有陰刻蝙蝠。爬蔓的葫蘆寓意子孫萬代，一旁的蝙蝠更加強多子福氣的吉祥意義。
玉葫蘆洗,https://digitalarchive.npm.gov.twhttps://digitalarchive.npm.gov.tw/opendata/Image/GetImage?imageId=150084&randomCode=43278767764,玉器,清,長7.34公分 寬4.35公分 通高1.2公分 白玉，玉色泛青。全器為葫蘆形小淺洗，洗中央有一隻立雕青蛙。洗一角飾有葫蘆藤蔓，並延伸至底部。底部則淺浮雕為一葫蘆。
玉柿形盒,https://digitalarchive.npm.gov.twhttps://digitalarchive.npm.gov.tw/opendata/Image/GetImage?imageId=150087&randomCode=61429074416,玉器,清,長7.1公分 寬5.4公分 通高1.6公分 白玉，玉色瑩白。全器為柿果實，呈長方扁形。蓋面為柿果底部，盒底則淺浮雕果蒂與相連枝葉，盒邊角另飾有靈芝。
翠玉盒底,https://digitalarchive.npm.gov.twhttps://digitalarchive.npm.gov.tw/opendata/Image/GetImage?imageId=150093&randomCode=37569483749,玉器,清,高2.0公分 口徑5.76公分 足徑4.1公分 翠玉，玉色白綠相雜。全器呈圓形，只剩盒身，缺盒蓋。子母口、弧形壁、有圈足。
玉壓尺,https://digitalarchive.npm.gov.twhttps://digitalarchive.npm.gov.tw/opendata/Image/GetImage?imageId=150096&randomCode=49523452070,玉器,清,長7.15公分 寬2.8公分 通高2.6公分 白玉，玉色泛黃。全器為長方形塊狀，玉塊上立雕一螭。附木座。木座足鏤雕卷雲。
玉墨床,https://digitalarchive.npm.gov.twhttps://digitalarchive.npm.gov.tw/opendata/Image/GetImage?imageId=150102&randomCode=83856982069,玉器,清,長6.74公分 寬2.7公分 通高1.9公分 白玉，玉色光潤。全器呈几形，兩端向內捲，板面一高一低，可放置墨錠。附木座。
玉墨床,https://digitalarchive.npm.gov.twhttps://digitalarchive.npm.gov.tw/opendata/Image/GetImage?imageId=150107&randomCode=59001447180,玉器,清,長8.1公分 寬2.15公分 通高1.8公分 白玉，玉色光潤。全器呈几形，兩端分別向外與向內捲，內捲處另出一小方足，立於木座上。板面平，平頂可放置墨錠。附木座。
翠玉燭台,https://digitalarchive.npm.gov.twhttps://digitalarchive.npm.gov.tw/opendata/Image/GetImage?imageId=152714&randomCode=286214864,玉器,清,全高6.2公分 口徑10.4公分 底徑6.0公分 翠玉，間有黃斑。全器分為燭台與承盤兩部分，與故玉1476為一對。燭台以花瓣為造形，承盤為口緣微侈的碗形，碗腹同為花瓣形。
玉碟,https://digitalarchive.npm.gov.twhttps://digitalarchive.npm.gov.tw/opendata/Image/GetImage?imageId=149582&randomCode=53154814851,玉器,清,高2.5公分 口徑11.08公分 底徑7.2公分 玉質，玉色泛黃，有赭斑，器身有多處裂璺。五尖瓣菱花式口，稍外撇，弧形壁，有圈足。器底圈足內有四字隸書款：「嘉慶年製」。
玉碟,https://digitalarchive.npm.gov.twhttps://digitalarchive.npm.gov.tw/opendata/Image/GetImage?imageId=150579&randomCode=38811192278,玉器,清,高2.5公分 口徑11.11公分 底徑7.2公分 玉質，玉色泛黃，有赭斑及裂璺。五尖瓣菱花式口，稍外撇，弧形壁，有圈足。器底圈足內有四字隸書款：「嘉慶年製」。
玉盤,https://digitalarchive.npm.gov.twhttps://digitalarchive.npm.gov.tw/opendata/Image/GetImage?imageId=149586&randomCode=78539006683,玉器,清 乾隆,高2.7公分 口徑13.57公分 底徑8.4公分 玉質，玉色泛白，有片狀赭斑。直口、弧形壁，有圈足。器底圈足內有六字篆書款：「大清乾隆年製」。
玉盤,https://digitalarchive.npm.gov.twhttps://digitalarchive.npm.gov.tw/opendata/Image/GetImage?imageId=149590&randomCode=28931248802,玉器,清 乾隆,高2.7公分 口徑13.22公分 底徑8.5公分 玉質，玉色泛白，有白綹及赭斑。直口、弧形壁，有圈足。器底圈足內有六字篆書款：「大清乾隆年製」。
玉碟,https://digitalarchive.npm.gov.twhttps://digitalarchive.npm.gov.tw/opendata/Image/GetImage?imageId=150583&randomCode=73176245600,玉器,清,高2.5公分 口徑11.11公分 底徑7.1公分 玉質，玉色泛黃，有赭斑，器身有多處裂璺。五尖瓣菱花式口，稍外撇，弧形壁，有圈足。器底圈足內有四字隸書款：「嘉慶年製」。
玉碟,https://digitalarchive.npm.gov.twhttps://digitalarchive.npm.gov.tw/opendata/Image/GetImage?imageId=150587&randomCode=88422727930,玉器,清,高2.4公分 口徑10.88公分 底徑6.7公分 玉質，玉色泛黃，有大片赭斑，器身有多處裂璺。五圓瓣葵花式口，稍外撇，弧形壁，有圈足。器底圈足內有四字隸書款：「嘉慶年製」。
玉盤,https://digitalarchive.npm.gov.twhttps://digitalarchive.npm.gov.tw/opendata/Image/GetImage?imageId=150591&randomCode=89275954487,玉器,清,高3.1公分 口徑16.1公分 底徑9.0公分 玉質，玉色泛白，有白綹。口外撇、弧形壁，有圈足。
玉盤,https://digitalarchive.npm.gov.twhttps://digitalarchive.npm.gov.tw/opendata/Image/GetImage?imageId=150593&randomCode=78134493603,玉器,清,高3.2公分 口徑16.2公分 底徑8.7公分 玉質，玉色泛白，口沿處有裂璺。口外撇、弧形壁，有圈足。
